{
  "stop": {
    "policy": "any",
    "total_instances": 2
  },
  "selection": "priority",
  "max_total_price_per_hour": 10,
  "max_wait_seconds": 1800,
  "state_file": ".local/autodl-state.json",
  "image": {
    "kind": "base",
    "uuid": "",
    "cuda_version": "12.8",
    "chip_corp": "nvidia",
    "cpu_arch": "x86"
  },
  "poll": {
    "interval_seconds": 10,
    "jitter_seconds": 3,
    "request_gap_seconds": 1
  },
  "targets": [
    {
      "name": "4090",
      "regions": [
        "西北B区",
        "北京B区"
      ],
      "gpu_models": [
        "RTX 4090"
      ],
      "quantity": 1,
      "gpus_per_instance": 1,
      "max_price_per_gpu_hour": 3
    },
    {
      "name": "3090",
      "regions": [
        "西北B区",
        "北京B区"
      ],
      "gpu_models": [
        "RTX 3090"
      ],
      "quantity": 1,
      "gpus_per_instance": 1,
      "max_price_per_gpu_hour": 2
    }
  ]
}
